{"artifactId":"artifact:gate-b:cohort-frozen-inputs-v1","classification":{"buildTooling":"static-generator-validator-tests-outside-runtime-authority","runtimeAuthority":"empty"},"contentDigest":{"algorithm":"sha256","canonicalization":"recursive-lexicographic-object-key-sort-arrays-preserve-order-json-utf8-lf-v1","domain":"shieldkit-labs/p2/gate-b/cohort-frozen-inputs/v1/root","frame":"utf8(domain)||0x00||canonical-json-utf8-with-top-level-contentDigest-omitted","value":"7f00510e5c4b8b4959b572c9c9ece8e97ca95174b5715c2ee0852ef79f28b08f"},"executionAllowed":false,"leafClosure":{"leafCount":2,"leaves":[{"id":"source-set-v1","leafDigest":{"algorithm":"sha256","canonicalization":"recursive-lexicographic-object-key-sort-arrays-preserve-order-json-utf8-lf-v1","domain":"shieldkit-labs/p2/gate-b/cohort-frozen-inputs/v1/leaf/source-set-v1","frame":"utf8(domain)||0x00||canonical-json-utf8-with-top-level-leafDigest-omitted","value":"da4d9c24cf7295bbe63c951269ff8c80191a93368241980347fdcf1b29162c82"},"nativeSemanticDigest":{"algorithm":"sha256","canonicalization":"recursive-lexicographic-object-key-sort-arrays-preserve-order-json-utf8-lf-v1","domain":"shieldkit-labs/p2/source-set/v1/root","frame":"utf8(domain)||0x00||canonical-json-utf8","value":"58e7765b066b1917b1fa0b4b96182010ad7f5c8ce8bce601c083bc764845482e"},"packageRoot":"research-lanes/bch-shielded-pool-design/p2/source-set-v1","wrapper":{"manifest":{"bytes":47562,"fileContentDigest":{"algorithm":"sha256","domain":"shieldkit-labs/p2/gate-b/cohort-frozen-inputs/v1/file","frame":"utf8(domain)||0x00||raw-file-bytes","value":"10e9fe1ab05e4f64f0e53de70543044f86b4cad727d9c2a435419ed1579c2bee"},"path":"research-lanes/bch-shielded-pool-design/p2/source-set-v1/MANIFEST.json","rawSha256":"d830276ccae8efe9ab10a04de539521a6637fd7a09429d5834c22fbcf5b33ba2"},"root":{"bytes":69768,"fileContentDigest":{"algorithm":"sha256","domain":"shieldkit-labs/p2/gate-b/cohort-frozen-inputs/v1/file","frame":"utf8(domain)||0x00||raw-file-bytes","value":"a925fb2d8cf73b15c2e7ba89d6b57823394a6741c98feb60237cb76d4a0ee3f4"},"path":"research-lanes/bch-shielded-pool-design/p2/source-set-v1/source-set.v1.json","rawSha256":"53e9acc311a123ad26908b84cf73149913781c1fe72253cc6cd28fef644751b5"},"sums":{"bytes":20855,"fileContentDigest":{"algorithm":"sha256","domain":"shieldkit-labs/p2/gate-b/cohort-frozen-inputs/v1/file","frame":"utf8(domain)||0x00||raw-file-bytes","value":"a7f90d6ad1d954744647c873cf6746e3ca09282736612cfb7016fa67209201e3"},"path":"research-lanes/bch-shielded-pool-design/p2/source-set-v1/SHA256SUMS","rawSha256":"8c108df96e1b5757fbb0ca93894496bade08ca5e8a9e68143f701c85380ff103"}}},{"artifactSemanticDigest":{"algorithm":"sha256","canonicalization":"recursive-lexicographic-object-key-sort-arrays-preserve-order-json-utf8-lf-v1","domain":"shieldkit-labs/p2/gate-b/execution-epoch/v2/root","frame":"utf8(domain)||0x00||canonical-json-utf8","value":"6fcbaba3bb52d5e1eb9c6f1cb04b1d46cb65e2c91eba20ca38356dc323ebb11e"},"id":"cohort-freeze-v2","leafDigest":{"algorithm":"sha256","canonicalization":"recursive-lexicographic-object-key-sort-arrays-preserve-order-json-utf8-lf-v1","domain":"shieldkit-labs/p2/gate-b/cohort-frozen-inputs/v1/leaf/cohort-freeze-v2","frame":"utf8(domain)||0x00||canonical-json-utf8-with-top-level-leafDigest-omitted","value":"26a0fa4fefd6dd5fde3eb841d251b7927d6175496417326c563cce8a524b7c18"},"packageRoot":"research-lanes/bch-shielded-pool-design/p2/gate-b/cohort-freeze-v2","wrapper":{"manifest":{"bytes":13213,"fileContentDigest":{"algorithm":"sha256","domain":"shieldkit-labs/p2/gate-b/cohort-frozen-inputs/v1/file","frame":"utf8(domain)||0x00||raw-file-bytes","value":"5c6933434fd4c3926f8a971fe276bdc173a135240e57f8c649cef6decdc24669"},"path":"research-lanes/bch-shielded-pool-design/p2/gate-b/cohort-freeze-v2/MANIFEST.json","rawSha256":"f600f81a716fb968ee1602c088e438d08008bce336e2191f68b37919b8bf5171"},"root":{"bytes":2885168,"fileContentDigest":{"algorithm":"sha256","domain":"shieldkit-labs/p2/gate-b/cohort-frozen-inputs/v1/file","frame":"utf8(domain)||0x00||raw-file-bytes","value":"857e55af249d5e189ee1f8d1cb0ddc50f735b59a3c61b1cc8a28beea5374a00e"},"path":"research-lanes/bch-shielded-pool-design/p2/gate-b/cohort-freeze-v2/execution-epoch.v2.json","rawSha256":"84ff8f6a85244b65d5d4f6e80c38b516223641ee444a133a67eb5794311d2dbc"},"sums":{"bytes":3913,"fileContentDigest":{"algorithm":"sha256","domain":"shieldkit-labs/p2/gate-b/cohort-frozen-inputs/v1/file","frame":"utf8(domain)||0x00||raw-file-bytes","value":"1cce0b54ce4bf9b037be5b0e351e8e7ce7cbf3edf56ca2910c91da66f73f5109"},"path":"research-lanes/bch-shielded-pool-design/p2/gate-b/cohort-freeze-v2/SHA256SUMS","rawSha256":"57eee7a1cc1fdd9c10e9f97176b77b138eb3b97949fe3bf1518bf1517f04275e"}}}]},"packageId":"cohort-frozen-inputs-v1","schema":"shieldkit-labs/p2/gate-b/cohort-frozen-inputs/v1/root","schemaBindings":[{"bytes":4592,"fileContentDigest":{"algorithm":"sha256","domain":"shieldkit-labs/p2/gate-b/cohort-frozen-inputs/v1/file","frame":"utf8(domain)||0x00||raw-file-bytes","value":"ad4b791a2be1e39dd3b8d7c1e626c8cd573b8cef99407f384eb19c514adce63b"},"path":"research-lanes/bch-shielded-pool-design/p2/gate-b/cohort-frozen-inputs-v1/schemas/frozen-inputs-root.v1.schema.json","rawSha256":"7d82dc2dc6f1e4c20d282b8db18787675e2bbb36d19b0d52c5186c1e468dc4db"},{"bytes":2831,"fileContentDigest":{"algorithm":"sha256","domain":"shieldkit-labs/p2/gate-b/cohort-frozen-inputs/v1/file","frame":"utf8(domain)||0x00||raw-file-bytes","value":"33207c76718af8324d892fba413bdb90d560838f65adb5b786eb0fc7e36c4268"},"path":"research-lanes/bch-shielded-pool-design/p2/gate-b/cohort-frozen-inputs-v1/schemas/manifest.v1.schema.json","rawSha256":"93806fa82a8cc20f21f4a5091697909d7169544d45b50bf28c385c4bddf5e787"}],"status":"static-content-addressed-frozen-inputs"}
